{
  "attribution": {
    "candidate_induced": true,
    "confidence": "medium",
    "evidence_tier": "B",
    "first_bad": null,
    "intentionality": "unknown",
    "owner_project": "pydata/xarray",
    "owner_repository": "https://github.com/pydata/xarray",
    "rationale": "Seed-corpus curation record derived from the manifest; full public collection and temporal review remain explicit release evidence requirements.",
    "responsible_layer": "downstream_project"
  },
  "case_id": "RADAR-OSINT-002",
  "downstream_subject": {
    "package": null,
    "repository": "https://github.com/pydata/xarray",
    "repository_full_name": "pydata/xarray",
    "revision": "unknown-revision",
    "source_signal": "https://github.com/pydata/xarray/issues/6197",
    "test_command_digest": null
  },
  "environments": {
    "candidate": {
      "dependency_snapshot_digest": null,
      "notes": null,
      "runtime": null,
      "variables": {}
    },
    "common": {
      "architecture": "unknown",
      "container_digest": null,
      "dependency_snapshot_digest": null,
      "locale": null,
      "network_policy": "unknown",
      "os": "public CI",
      "runner": "unknown",
      "timezone": "UTC"
    },
    "control": {
      "dependency_snapshot_digest": null,
      "notes": null,
      "runtime": null,
      "variables": {}
    },
    "resolution_mode": "unknown"
  },
  "evidence": [
    {
      "available_before_cutoff": true,
      "collected_at": "2022-01-27T00:00:00Z",
      "digest": null,
      "evidence_id": "E-RADAR_OSINT_002",
      "kind": "issue",
      "notes": "Seed-manifest source reference; public content must be independently collected before a headline result.",
      "uri": "https://github.com/pydata/xarray/issues/6197"
    }
  ],
  "experiments": [],
  "failure": {
    "exception_or_tool": null,
    "fingerprint": "sha256:0000000000000000000000000000000000000000000000000000000000000000",
    "message_template": "h5netcdf behavior exposed an xarray backend adaptation need.",
    "phase": "runtime",
    "symbol": null,
    "test_identifiers": []
  },
  "hypotheses": [],
  "lifecycle": {
    "closed_at": null,
    "observed_at": "2022-01-27T00:00:00Z",
    "state": "resolved",
    "updated_at": "2022-01-27T00:00:00Z"
  },
  "outcomes": {
    "candidate": {
      "attempts": 1,
      "duration_seconds": null,
      "evidence_ids": [
        "E-RADAR_OSINT_002"
      ],
      "exit_code": null,
      "status": "fail",
      "workflow_run": null
    },
    "control": {
      "attempts": 1,
      "duration_seconds": null,
      "evidence_ids": [
        "E-RADAR_OSINT_002"
      ],
      "exit_code": null,
      "status": "pass",
      "workflow_run": null
    }
  },
  "privacy": {
    "raw_logs_shared": false,
    "redactions": [
      "No raw logs or secrets are included; source URLs are references only."
    ],
    "source_code_shared": false,
    "visibility": "public"
  },
  "provenance": {
    "attestation_uri": null,
    "collected_at": "2026-08-08T13:08:23.484612Z",
    "collector": "Radar seed manifest",
    "collector_version": "0.1",
    "record_digest": null,
    "source_snapshot_cutoff": "2022-01-27T00:00:00Z",
    "workflow_revision": null
  },
  "related_cases": [],
  "resolution": {
    "status": "unknown"
  },
  "schema_version": "0.1",
  "summary": "h5netcdf behavior exposed an xarray backend adaptation need.",
  "title": "nightly upstream dependency CI",
  "upstream_change": {
    "candidate": {
      "artifact_digest": null,
      "artifact_uri": null,
      "revision": null,
      "version": "candidate"
    },
    "control": {
      "artifact_digest": null,
      "artifact_uri": null,
      "revision": null,
      "version": "control"
    },
    "ecosystem": "public Python ecosystem",
    "event_type": "unknown",
    "kind": "library",
    "project": "pydata/xarray",
    "repository": "https://github.com/pydata/xarray"
  }
}
